<?xml version="1.0" encoding="ISO-8859-1"?>
<!-- created by MXML on Fri Feb 03 15:40:38 2006 -->
<Configuration xmlns:xsi="http://www.w3.org/2001/XMLSchema-instance" xsi:noNamespaceSchemaLocation="c:/rome/romeConfig.xsd">
  <ProgramConfiguration>
    <ROME>
      <Active>true</Active>
    </ROME>
    <ARGUS>
      <Active>false</Active>
    </ARGUS>
  </ProgramConfiguration>
  <MainConfiguration>
    <RunNumbers>1</RunNumbers>
    <EventNumbers>0-1000</EventNumbers>
    <InputFileNames></InputFileNames>
    <Modes>
      <AnalyzingMode>offline</AnalyzingMode>
      <DAQSystem>none</DAQSystem>
      <BatchMode>false</BatchMode>
      <QuitMode>false</QuitMode>
      <ShowSplashScreen>false</ShowSplashScreen>
    </Modes>
    <DataBases/>
    <Online>
      <Host></Host>
      <Experiment></Experiment>
    </Online>
    <SocketInterface>
      <PortNumber>9090</PortNumber>
      <AvailableOffline>false</AvailableOffline>
    </SocketInterface>
    <Paths>
      <InputFilePath>./</InputFilePath>
      <OutputFilePath>./</OutputFilePath>
    </Paths>
    <Tasks>
      <Task>
        <TaskName>FillTree</TaskName>
        <Active>true</Active>
      </Task>
      <Task>
        <TaskName>PrintValue</TaskName>
        <Active>true</Active>
      </Task>
    </Tasks>
    <Trees>
      <Accumulate>false</Accumulate>
      <Tree>
        <TreeName>DataTree</TreeName>
        <Read>false</Read>
        <Write>true</Write>
        <Fill>true</Fill>
        <CompressionLevel>0</CompressionLevel>
        <MaxNumberOfEntries>0</MaxNumberOfEntries>
        <TreeOutputFileName></TreeOutputFileName>
      </Tree>
    </Trees>
    <Midas/>
  </MainConfiguration>
</Configuration>
