<?xml version="1.0" encoding="ISO-8859-1"?>
<!-- created by MXML on Tue Nov 22 11:08:20 2005 -->
<Configuration xmlns:xsi="http://www.w3.org/2001/XMLSchema-instance" xsi:noNamespaceSchemaLocation="c:/rome/romeConfig.xsd">
	<MainConfiguration>
		<RunParameters>
			<RunNumbers>1,2</RunNumbers>
			<EventNumbers>1-4</EventNumbers>
			<InputFileNames/>
		</RunParameters>
		<Modes>
			<AnalyzingMode>offline</AnalyzingMode>
			<DAQSystem>database</DAQSystem>
			<BatchMode>false</BatchMode>
			<ShowSplashScreen>false</ShowSplashScreen>
		</Modes>
		<DataBases>
			<DataBase>
				<Name>mydatabase</Name>
				<Connection>./xmldatabase;stepbystepdbdaq</Connection>
				<Type>xml</Type>
				<EventBased>false</EventBased>
			</DataBase>
		</DataBases>
		<Online>
			<Host/>
			<Experiment/>
		</Online>
		<SocketInterface>
			<PortNumber>9090</PortNumber>
			<AvailableOffline>false</AvailableOffline>
		</SocketInterface>
		<Paths>
			<InputFilePath>./</InputFilePath>
			<OutputFilePath>./</OutputFilePath>
		</Paths>
		<Tasks>
			<Task>
				<TaskName>PrintADCValues</TaskName>
				<Active>true</Active>
			</Task>
		</Tasks>
		<Trees>
			<Accumulate>false</Accumulate>
			<Tree>
				<TreeName>DataTree</TreeName>
				<Read>false</Read>
				<Write>false</Write>
				<Fill>false</Fill>
				<CompressionLevel>0</CompressionLevel>
				<MaxNumberOfEntries>0</MaxNumberOfEntries>
				<TreeOutputFileName/>
			</Tree>
		</Trees>
		<GlobalSteeringParameters>
			<SteeringParameterField>
				<SPName>OutputOnOff</SPName>
				<SPValue>true</SPValue>
			</SteeringParameterField>
		</GlobalSteeringParameters>
		<Midas/>
	</MainConfiguration>
</Configuration>
