<?xml version="1.0" encoding="ISO-8859-1"?>
<!-- created by MXML on Mon Dec 19 09:09:27 2005 -->
<Configuration xmlns:xsi="http://www.w3.org/2001/XMLSchema-instance" xsi:noNamespaceSchemaLocation="c:/rome/rome/romeConfig.xsd">
  <MainConfiguration>
    <RunNumbers></RunNumbers>
    <EventNumbers></EventNumbers>
    <InputFileNames></InputFileNames>
    <Modes>
      <AnalyzingMode>offline</AnalyzingMode>
      <DAQSystem>none</DAQSystem>
      <BatchMode>false</BatchMode>
      <ShowSplashScreen>false</ShowSplashScreen>
    </Modes>
    <DataBases/>
    <Online>
      <Host></Host>
      <Experiment></Experiment>
    </Online>
    <SocketInterface>
      <PortNumber>9090</PortNumber>
      <AvailableOffline>false</AvailableOffline>
    </SocketInterface>
    <Paths>
      <InputFilePath>./</InputFilePath>
      <OutputFilePath>./</OutputFilePath>
    </Paths>
    <Tasks>
      <Task>
        <TaskName>TaskA</TaskName>
        <Active>true</Active>
        <SteeringParameterField>
          <SPName>output</SPName>
          <SPValue>1. A</SPValue>
        </SteeringParameterField>
        <Task>
          <TaskName>TaskA</TaskName>
          <Active>true</Active>
          <SteeringParameterField>
            <SPName>output</SPName>
            <SPValue>sub A of 1. A</SPValue>
          </SteeringParameterField>
        </Task>
      </Task>
      <Task>
        <TaskName>TaskB</TaskName>
        <Active>true</Active>
        <SteeringParameterField>
          <SPName>output</SPName>
          <SPValue>1. B</SPValue>
        </SteeringParameterField>
        <Task>
          <TaskName>TaskA</TaskName>
          <Active>true</Active>
          <SteeringParameterField>
            <SPName>output</SPName>
            <SPValue>sub A of 1. B</SPValue>
          </SteeringParameterField>
        </Task>
      </Task>
      <Task>
        <TaskName>TaskA</TaskName>
        <Active>true</Active>
        <SteeringParameterField>
          <SPName>output</SPName>
          <SPValue>1. A</SPValue>
        </SteeringParameterField>
        <Task>
          <TaskName>TaskA</TaskName>
          <Active>true</Active>
          <SteeringParameterField>
            <SPName>output</SPName>
            <SPValue>sub A of 1. A</SPValue>
          </SteeringParameterField>
        </Task>
      </Task>
    </Tasks>
    <Midas/>
  </MainConfiguration>
</Configuration>
